number,value,datetime_start,datetime_complete,duration,params_batch_size,params_channels,params_dropout,params_lr,params_weight_decay,system_attrs_tpe:relative_params:0,state
0,0.9877694813107925,2026-10-02 12:28:45.487007,2026-10-02 12:29:24.449110,0 days 00:00:38.962103,16,large,0.3005575058716044,0.0003574712922600243,0.0006796578090758161,,COMPLETE
1,0.9781385856334733,2026-10-02 12:29:24.763698,2026-10-02 12:30:02.257728,0 days 00:00:37.494030,16,large,0.21597250932105788,0.00010725209743172001,1.461896279370496e-05,,COMPLETE
2,0.9795362995307285,2026-10-02 12:30:02.585479,2026-10-02 12:30:28.181962,0 days 00:00:25.596483,128,small,0.29620728443102123,0.0008012737503998541,1.5339162591163623e-06,,COMPLETE
3,0.9795116174008074,2026-10-02 12:30:28.591579,2026-10-02 12:30:53.672714,0 days 00:00:25.081135,128,small,0.34211651325607845,0.0007896186801026692,5.762487216478604e-05,,COMPLETE
4,0.9713826042299456,2026-10-02 12:30:54.000289,2026-10-02 12:31:19.117689,0 days 00:00:25.117400,64,small,0.2733551396716398,0.00015144860262751404,5.4880470007660465e-06,,COMPLETE
5,0.98910808081781,2026-10-02 12:31:19.434036,2026-10-02 12:31:45.091514,0 days 00:00:25.657478,32,small,0.022613644455269033,0.0027051668818999287,2.0013420622879995e-05,,COMPLETE
6,0.9863943311564263,2026-10-02 12:31:45.391927,2026-10-02 12:32:20.088514,0 days 00:00:34.696587,32,large,0.03727532183988541,0.00037507963596256056,0.008862326508576254,,COMPLETE
7,0.9506180283766184,2026-10-02 12:32:20.392812,2026-10-02 12:32:33.801166,0 days 00:00:13.408354,64,medium,0.1792328642721363,0.0013826083091896758,2.907208890659845e-06,,PRUNED
8,0.7893559030936157,2026-10-02 12:32:34.123972,2026-10-02 12:32:48.799717,0 days 00:00:14.675745,16,medium,0.44360637128816327,0.0018832519048593583,7.742116473996259e-05,,PRUNED
9,0.552549463760073,2026-10-02 12:32:49.107900,2026-10-02 12:33:03.362722,0 days 00:00:14.254822,128,medium,0.012709563372047594,0.00015019490572374368,2.7012557725439094e-06,,PRUNED
10,0.9822983327674982,2026-10-02 12:33:03.674538,2026-10-02 12:33:29.047838,0 days 00:00:25.373300,32,small,0.37649378992933835,0.0014976021705011954,0.006890087897266936,"{""batch_size"": 32, ""channels"": ""small"", ""dropout"": 0.37649378992933835, ""lr"": 0.0014976021705011954, ""weight_decay"": 0.006890087897266936}",COMPLETE
11,0.9877716488336545,2026-10-02 12:33:29.366184,2026-10-02 12:34:07.567531,0 days 00:00:38.201347,16,large,0.16657944283271697,0.0006874278741649368,0.0004898556180945836,"{""batch_size"": 16, ""channels"": ""large"", ""dropout"": 0.16657944283271697, ""lr"": 0.0006874278741649368, ""weight_decay"": 0.0004898556180945836}",COMPLETE
12,0.9850542374633555,2026-10-02 12:34:07.943676,2026-10-02 12:34:32.491846,0 days 00:00:24.548170,32,small,0.0037338868123094823,0.002649521643838724,0.0002264737682482783,"{""batch_size"": 32, ""channels"": ""small"", ""dropout"": 0.0037338868123094823, ""lr"": 0.002649521643838724, ""weight_decay"": 0.0002264737682482783}",COMPLETE
13,0.9675017987460172,2026-10-02 12:34:32.824299,2026-10-02 12:34:55.657873,0 days 00:00:22.833574,16,large,0.02504977222463342,0.0005413209540767683,1.4518406084757936e-05,"{""batch_size"": 16, ""channels"": ""large"", ""dropout"": 0.02504977222463342, ""lr"": 0.0005413209540767683, ""weight_decay"": 1.4518406084757936e-05}",PRUNED
14,0.8286943402585063,2026-10-02 12:34:55.978357,2026-10-02 12:35:11.083137,0 days 00:00:15.104780,16,large,0.16567029086063365,0.002612895177204273,8.821519101972607e-05,"{""batch_size"": 16, ""channels"": ""large"", ""dropout"": 0.16567029086063365, ""lr"": 0.002612895177204273, ""weight_decay"": 8.821519101972607e-05}",PRUNED
15,0.987770926411402,2026-10-02 12:35:11.426214,2026-10-02 12:35:36.692734,0 days 00:00:25.266520,32,small,0.16286769174817503,0.0012603603054579153,3.692315442562708e-05,"{""batch_size"": 32, ""channels"": ""small"", ""dropout"": 0.16286769174817503, ""lr"": 0.0012603603054579153, ""weight_decay"": 3.692315442562708e-05}",COMPLETE
16,0.987767966731616,2026-10-02 12:35:37.027628,2026-10-02 12:36:14.769309,0 days 00:00:37.741681,16,large,0.010758184183806307,0.0001605480846853721,0.001192103387625338,"{""batch_size"": 16, ""channels"": ""large"", ""dropout"": 0.010758184183806307, ""lr"": 0.0001605480846853721, ""weight_decay"": 0.001192103387625338}",COMPLETE
17,0.9537389349723534,2026-10-02 12:36:15.085104,2026-10-02 12:36:28.657639,0 days 00:00:13.572535,64,large,0.10096159258286087,0.0006830016101099616,0.00026303760587985587,"{""batch_size"": 64, ""channels"": ""large"", ""dropout"": 0.10096159258286087, ""lr"": 0.0006830016101099616, ""weight_decay"": 0.00026303760587985587}",PRUNED
18,0.9863751113751115,2026-10-02 12:36:28.991670,2026-10-02 12:36:56.715280,0 days 00:00:27.723610,16,small,0.11052375275449414,0.00020320632260839529,0.00028485524654488817,"{""batch_size"": 16, ""channels"": ""small"", ""dropout"": 0.11052375275449414, ""lr"": 0.00020320632260839529, ""weight_decay"": 0.00028485524654488817}",COMPLETE
19,0.9877826054937772,2026-10-02 12:36:57.043268,2026-10-02 12:37:22.996676,0 days 00:00:25.953408,32,small,0.048401439206787814,0.0012143519387680462,2.875479796759757e-06,"{""batch_size"": 32, ""channels"": ""small"", ""dropout"": 0.048401439206787814, ""lr"": 0.0012143519387680462, ""weight_decay"": 2.875479796759757e-06}",COMPLETE
